{
  "$schema": "http://json-schema.org/draft-07/schema#",
  "title": "AgentManifest",
  "description": "Schema for AgentStore agent marketplace listings",
  "type": "object",
  "required": ["id", "name", "description", "category", "tools_required"],
  "properties": {
    "id": { "type": "string" },
    "name": { "type": "string" },
    "description": { "type": "string" },
    "category": {
      "type": "string",
      "enum": [
        "Productivity", "Developer Tools", "Education", "Career",
        "Travel", "Finance", "Content Creation", "Data Analysis",
        "Communication", "Personal Assistant"
      ]
    },
    "creator": { "type": "string" },
    "version": { "type": "string" },
    "status": { "type": "string", "enum": ["draft", "published", "archived"] },
    "rating": { "type": "number", "minimum": 0, "maximum": 5 },
    "downloads": { "type": "integer" },
    "installs": { "type": "integer" },
    "runs": { "type": "integer" },
    "tags": { "type": "array", "items": { "type": "string" } },
    "tools_required": { "type": "array", "items": { "type": "string" } },
    "permissions_required": { "type": "array", "items": { "type": "string" } },
    "inputs": { "type": "object" },
    "outputs": { "type": "object" },
    "example_use_case": { "type": "string" },
    "example_prompts": { "type": "array", "items": { "type": "string" } }
  }
}
